{
  "id": "01a16eb0-2b48-72dc-bf52-42bb453a495c",
  "name": "Elden Ring",
  "steamAppId": 1245620,
  "events": [
    {
      "id": "01a16eb0-2b48-72dc-bf52-46a3de2ac8e9",
      "name": { "en": "Death", "fr": "Mort" },
      "draws": 1,
      "maxPerSession": 15,
      "jokers": 0
    },
    {
      "id": "01a16eb0-2b48-72dc-bf52-48740398aa82",
      "name": { "en": "Rest at a known Site of Grace", "fr": "Repos à un site de grâce connu" },
      "draws": 1,
      "jokers": 0
    },
    {
      "id": "01a16eb0-2b48-72dc-bf52-4dc745f50923",
      "name": { "en": "Site of Grace discovered", "fr": "Site de grâce découvert" },
      "draws": 1,
      "jokers": 0
    },
    {
      "id": "01a16eb0-2b48-72dc-bf52-52117be702d0",
      "name": { "en": "Level up", "fr": "Montée de niveau" },
      "draws": 1,
      "jokers": 0
    },
    {
      "id": "01a16eb0-2b48-72dc-bf52-5477800651f0",
      "name": { "en": "Runes lost", "fr": "Runes perdues" },
      "draws": 1,
      "jokers": 0
    },
    {
      "id": "01a16eb0-2b48-72dc-bf52-5a36d7c066ab",
      "name": { "en": "Boss defeated", "fr": "Boss vaincu" },
      "draws": 2,
      "jokers": 0
    },
    {
      "id": "01a16eb0-2b48-72dc-bf52-5d97cd79df75",
      "name": { "en": "Boss defeated on the first try", "fr": "Boss vaincu au premier essai" },
      "draws": 2,
      "jokers": 1
    },
    {
      "id": "01a16eb0-2b48-72dc-bf52-618829b0dcf0",
      "name": { "en": "Boss defeated without getting hit", "fr": "Boss vaincu sans prendre un coup" },
      "draws": 2,
      "jokers": 2
    }
  ]
}
