{
  "id": "01a16eb0-2b47-73b1-908b-8199d6dd444d",
  "name": "Dark Souls II",
  "steamAppId": 335300,
  "events": [
    {
      "id": "01a16eb0-2b47-73b1-908b-85ec57f909ed",
      "name": { "en": "Death", "fr": "Mort" },
      "draws": 1,
      "maxPerSession": 15,
      "jokers": 0
    },
    {
      "id": "01a16eb0-2b47-73b1-908b-8813adcf768e",
      "name": { "en": "Rest at a known bonfire", "fr": "Repos à un feu connu" },
      "draws": 1,
      "jokers": 0
    },
    {
      "id": "01a16eb0-2b47-73b1-908b-8c64cf888bb6",
      "name": { "en": "New bonfire lit", "fr": "Nouveau feu allumé" },
      "draws": 1,
      "jokers": 0
    },
    {
      "id": "01a16eb0-2b47-73b1-908b-9249b93cfa10",
      "name": { "en": "Level up", "fr": "Montée de niveau" },
      "draws": 1,
      "jokers": 0
    },
    {
      "id": "01a16eb0-2b47-73b1-908b-95fbd9c60dc3",
      "name": { "en": "Souls lost", "fr": "Âmes perdues" },
      "draws": 1,
      "jokers": 0
    },
    {
      "id": "01a16eb0-2b47-73b1-908b-99b73298af26",
      "name": { "en": "Boss defeated", "fr": "Boss vaincu" },
      "draws": 2,
      "jokers": 0
    },
    {
      "id": "01a16eb0-2b47-73b1-908b-9d1706e0266a",
      "name": { "en": "Boss defeated on the first try", "fr": "Boss vaincu au premier essai" },
      "draws": 2,
      "jokers": 1
    },
    {
      "id": "01a16eb0-2b47-73b1-908b-a3314c05108d",
      "name": { "en": "Boss defeated without getting hit", "fr": "Boss vaincu sans prendre un coup" },
      "draws": 2,
      "jokers": 2
    }
  ]
}
