{
  "id": "01a16eb0-2b47-73b1-908b-5e49c6fdda38",
  "name": "Dark Souls",
  "steamAppId": 570940,
  "events": [
    {
      "id": "01a16eb0-2b47-73b1-908b-6208fe2f463f",
      "name": { "en": "Death", "fr": "Mort" },
      "draws": 1,
      "maxPerSession": 15,
      "jokers": 0
    },
    {
      "id": "01a16eb0-2b47-73b1-908b-64c7e28de0ea",
      "name": { "en": "Rest at a known bonfire", "fr": "Repos à un feu connu" },
      "draws": 1,
      "jokers": 0
    },
    {
      "id": "01a16eb0-2b47-73b1-908b-683109b30554",
      "name": { "en": "New bonfire lit", "fr": "Nouveau feu allumé" },
      "draws": 1,
      "jokers": 0
    },
    {
      "id": "01a16eb0-2b47-73b1-908b-6e22a0830509",
      "name": { "en": "Level up", "fr": "Montée de niveau" },
      "draws": 1,
      "jokers": 0
    },
    {
      "id": "01a16eb0-2b47-73b1-908b-720c7b34f730",
      "name": { "en": "Souls lost", "fr": "Âmes perdues" },
      "draws": 1,
      "jokers": 0
    },
    {
      "id": "01a16eb0-2b47-73b1-908b-76dae85048cd",
      "name": { "en": "Boss defeated", "fr": "Boss vaincu" },
      "draws": 2,
      "jokers": 0
    },
    {
      "id": "01a16eb0-2b47-73b1-908b-7b64827b0440",
      "name": { "en": "Boss defeated on the first try", "fr": "Boss vaincu au premier essai" },
      "draws": 2,
      "jokers": 1
    },
    {
      "id": "01a16eb0-2b47-73b1-908b-7e2806f18ef5",
      "name": { "en": "Boss defeated without getting hit", "fr": "Boss vaincu sans prendre un coup" },
      "draws": 2,
      "jokers": 2
    }
  ]
}
